ENABLE,release_key,id,mst_enemy_character_id,language,name,description
e,202601010,chara_jig_00401_ja,chara_jig_00401,ja,"賊王 亜左 弔兵衛","“賊王”の呼び名で、伊予の山奥に賊の村をもつ傑士。\n強さこそが全てだと信じ、目的のためには手段を選ばない冷酷さと高い適応能力、賊をまとめ上げる天賦の才能で、圧倒的な戦闘力を誇る。唯一の身内で大切に思っている実の弟の山田浅ェ門 桐馬と共に数々の状況を潜り抜けてきた。"
e,202601010,chara_jig_00501_ja,chara_jig_00501,ja,"山田浅ェ門 桐馬","山田浅ェ門・試一刀流、段位未定。\n亜左 弔兵衛の実の弟で監視役。兄を助けるために山田家に入門し、わずか1か月で代行免許を得る天稟を持つ。冷静沈着で知的な一面を持ちながらも、その身を賭してでも兄を守ろうとする強い覚悟を持っている。"
e,202601010,chara_jig_00601_ja,chara_jig_00601,ja,"民谷 巌鉄斎","“八洲無双の剣龍”と呼ばれる剣豪。\n藩主の屋敷にあった門扉の龍を切ったことにより、不敬罪に問われ死罪人となった。天下に轟く偉業を成し、後世に語り継がれる名前を残すことによって真の不老不死になることを史上の目標にしている。"
e,202601010,enemy_jig_00501_ja,enemy_jig_00501,ja,"山田浅ェ門 源嗣","山田浅ェ門・試一刀流、八位。頑固だが、山田浅ェ門 佐切を案じる優しい一面も持ち合わせる。"
e,202601010,enemy_jig_00601_ja,enemy_jig_00601,ja,朱槿,仙薬を守る仙人のうちの1人、朱槿(ヂュジン)。再生能力を持ち、性別も時に入れ替わる。
