ENABLE,release_key,id,mst_enemy_character_id,language,name,description
e,202603010,chara_hut_00001_ja,chara_hut_00001,ja,"ひたむきギタリスト 鳩野 ちひろ",「はーとぶれいく」のギターボーカル担当。高校1年生。ちょっと渋めな邦ロックを愛している。高校入学を機に憧れのギターを購入し、軽音学部に入部した。ちょっぴり自意識過剰な性格で、中学生時代の出来事から人前で歌うことに抵抗があるものの、人を惹きつける歌声をしている。
e,202603010,chara_hut_00101_ja,chara_hut_00101,ja,"幸山 厘","「はーとぶれいく」のベース担当。高校1年生。成績優秀でベースの腕もあるが、なぜか鳩野 ちひろを神とあがめている。策略家な一面があり、最初のバンド「ラチッタデッラ」解散後、内田 桃と藤井 彩目を引き入れ「はーとぶれいく」を結成する。"
e,202603010,chara_hut_00201_ja,chara_hut_00201,ja,"内田 桃","バンドのドラム担当。高校1年生。鳩野 ちひろのクラスメイトで、入学してすぐに仲良くなった。恋愛に対してコンプレックスを抱えている。最初に組んだバンド「sound sleep」の解散後、「はーとぶれいく」に加入することに。"
e,202603010,chara_hut_00301_ja,chara_hut_00301,ja,"藤井 彩目","バンドのギター担当。高校1年生。ギターは上手いが周りの人間を見下しがちな性格。鷹見 項希と交際していたが、破局。軽音楽部を退部しようとしていたが、鳩野 ちひろの弾き語りに心を動かされ、「はーとぶれいく」へ加入することに。"
e,202603010,enemy_hut_00001_ja,enemy_hut_00001,ja,"鷹見 項希",「protocol.」のギターボーカル。歌もギターもうまいため、部内で一目置かれており、とにかく女子にモテる。
