ENABLE,release_key,id,mst_unit_id,language,name,description,detail
e,202509010,chara_kai_00601_ja,chara_kai_00601,ja,"古橋 伊春","防衛隊隊員で、カフカやキコルたちと同期。\n負けず嫌いで言葉はやや荒いが情に厚いムードメーカー。ライバル視しているレノが頭角を表していく様子に焦りを感じながらも努力を絶やさない、真面目で熱い一面を持つ。",必殺ワザで自身の攻撃をUPできるディフェンスキャラ!
e,202509010,chara_sur_00401_ja,chara_sur_00401,ja,"大川村 寧","魔防隊七番組の隊員。\n隊最年少の11歳で小学生。魔防隊所属ながら非戦闘要員。優しい性格で、先に入隊した上司として和倉 優希を気にかける。能力は「きっと見つける」。千里眼のような力で索敵し、隊を補佐する。","必殺ワザで次回発動するJUMBLE RUSHのダメージをUPすることができるぞ!"
e,202509010,chara_spy_00001_ja,chara_spy_00001,ja,"わくわく アーニャ","孤児院に預けられていた少女。\nロイド・フォージャーに引き取られ、娘として暮らしている。実は他人の心を読むことができる超能力者で、周囲の人にはそのことを隠している。スパイと殺し屋との共同生活にわくわくしている。",必殺ワザで特定のコマにいる味方を一気に回復!さらに味方の攻撃をUPすることができ、万能に活躍できるぞ!
e,202510010,chara_spy_00301_ja,chara_spy_00301,ja,ダミアン・デズモンド,"ドノバン・デズモンドの息子。\n学園では親の権力を笠に着て傲慢な態度を取っているが、根は優しく誇り高い少年。アーニャ・フォージャーにぶっ飛ばされて以来、気になっている。“プランB”成功の鍵となる標的。",必殺ワザで特定のコマにいる味方アタックキャラの攻撃をUP!特定のタイミングで火力を上げたい時に活躍!
e,202509010,chara_dos_00101_ja,chara_dos_00101,ja,"秋野 沙友理","北陵高等学校に通う、黒髪清楚系ギャル。\nゲームが得意だが恥ずかしがり屋な性格。スキー授業で冬木 美波に助けられ、友達となる。四季 翼のことを意識しているが、冬木 美波との友情も大事にしたいと思っている。",特定のコマにいる味方ディフェンスキャラの被ダメージをカット!味方の体力がピンチな時に活躍する!
e,202510020,chara_dan_00201_ja,chara_dan_00201,ja,アイラ,"オカルンやモモと同じ高校に通う女子高生で、自他共に認める美少女。\nオカルンの金の玉を拾ったことで能力が開花してしまう。普段は天然な美少女を演じているが、一度思い込むと周りの声が聞こえなくなってしまう、頑固な一面もある。",必殺ワザで自身と青属性の味方の被ダメージをカットできるぞ!
e,202510020,chara_dan_00202_ja,chara_dan_00202,ja,"アクさらの愛 アイラ","アクロバティックさらさらの炎を体内に取り入れたことにより、能力を得たアイラの姿。\n平常時より髪の毛が著しく伸び、自由に操ることができる他、バレエを踊るような優雅さで足技を駆使して戦う。アクロバティックさらさらのような口の悪いお嬢様口調で喋る。",中距離からの攻撃を得意とするアタックキャラ!必殺ワザの連続攻撃で単体の相手にダメージを与えるぞ!
e,202510020,chara_dan_00301_ja,chara_dan_00301,ja,"招き猫 ターボババア","神出鬼没で、全国各地で暴れ回ってた近代妖怪。\nオカルン達に倒された後消えたと思われていたが、実はオカルンの中に隠れていた。今は力をオカルンの中に残し、意識のみが招き猫の中に入って動き回っている。\n現在はモモの家で暮らしている。",耐久力特化のディフェンスキャラ!必殺ワザで自身が受けるダメージをカットできるぞ!
e,202511010,chara_mag_00201_ja,chara_mag_00201,ja,"絶対効率の体現者 土刃 メイ","業界大手・『アスト株式会社』に所属する魔法少女。\n効率を重視し、最小の手数で最大の成果を上げる機械のような精度で結果を積み上げ、社内でもトップの納品数を誇っている。感情をほとんど表に出さず、常に無表情で業務にあたるその戦い方には一切の無駄がない。",遠距離からの連続範囲攻撃とノックバックで前線を押し上げることができるアタックキャラ!さらに、特定の条件で自身の攻撃をUPするぞ!
e,202511010,chara_mag_00301_ja,chara_mag_00301,ja,"葵 リリー","大手化粧品メーカー『ミヤコ堂』の魔法少女。\n芯の強さと気品を併せ持つ美の体現者。魔法少女は素敵な仕事であることを伝えたいと考えている。株式会社マジルミエとの協働業務にて、桜木 カナとバディを組み、優雅かつ的確に怪異の対処にあたった。",中距離で戦うディフェンスキャラ!必殺ワザで自身が受けるダメージをカットできるぞ!
e,202511010,chara_mag_00401_ja,chara_mag_00401,ja,"槇野 あかね","新技術の研修のため『株式会社マジルミエ』へ出向してきた、『アプダ株式会社』に所属する魔法少女。\n上昇志向で、仕事熱心な性格。業務に関する新しくて良いものは取り入れたい、選択肢は沢山持っておきたいといった思いを持っている。",必殺ワザの攻撃DOWNを駆使して戦うテクニカルキャラ!
e,202511010,chara_mag_00501_ja,chara_mag_00501,ja,"重本 浩司","『株式会社マジルミエ』の社長で、魔法少女絶対主義者。\n会社では常に魔法少女のコスプレをしており、初見の人を驚かせている。新人の桜木 カナに重大な局面を任せたり、社員の成長を素直に喜んだりと、従業員を信頼した経営のできる人物。",必殺ワザで特定のコマにいる味方アタックキャラへのダメージをカットするぞ!
e,202511020,chara_yuw_00201_ja,chara_yuw_00201,ja,"羽生 まゆり","奥村 正宗たちの通う高校の新任教師にして、漫画研究部の顧問。以前はコスプレ四天王まゆらとして活動していた。引退していたが、コスプレや、コスプレイヤーのことは愛しており、何かと協力は惜しまない良き顧問教師。",必殺ワザで複数の相手の攻撃をDOWNして、戦況をコントロールするテクニカルキャラ！
e,202511020,chara_yuw_00301_ja,chara_yuw_00301,ja,"勇気を纏うコスプレ 乃愛","高校1年生。カメラおじさんのブログに5人の新星レイヤーとして選出されたうちの1人。友達が欲しくてコスプレを始めるが、極度の人見知りで苦戦していた。天乃 リリサとの出会いから自身のトラウマと向き合い、一緒にコスプレをする友人となった。",チームの火力を引き上げるサポートキャラ！必殺ワザの攻撃UPでチーム全体を優位に導くことができるぞ！
e,202511020,chara_yuw_00401_ja,chara_yuw_00401,ja,"伝えたいウチの想い 喜咲 アリア","高校生のギャル。アウトドア派で誰にでもフレンドリー。距離を詰めるのが非常に早い。コスプレを始めた理由は、父親に今でも「ヴァル戦」が好きだと伝えたいから。コスプレ初心者だったが、天乃 リリサに指導されるうちにコスプレにハマり出す。",必殺ワザで単体の相手に大ダメージを与え、ノックバックさせることができる!さらに、特定の条件で自身の被ダメージをカットできるぞ!
e,202511020,chara_yuw_00501_ja,chara_yuw_00501,ja,753♡,コスプレ四天王にして、プロのコスプレイヤー。誰よりもコスプレとコスプレイヤーを愛していると自負しており、非常にプライドが高い。衣装の圧倒的なクオリティと、キャラクターの知名度や流行感、本人の人気を活かし、トップレイヤーとしての実力を発揮している。,必殺ワザで自身と赤属性の味方のダメージをカットできるぞ!
e,202511020,chara_yuw_00601_ja,chara_yuw_00601,ja,"奥村 正宗","高校2年生。漫画研究部の唯一の部員にして部長。\n母親が突然いなくなったり、姉に疎まれたりした過去から3次元の女性に苦手意識を持つようになり、自他の恋愛感情に鈍感。「2次元は俺の嫁」と豪語するほどのリリエル好きでオタク。",必殺ワザで自身が受けるダメージをカットできるディフェンスキャラ!相手の攻撃に合わせた必殺ワザの発動がカギ!
e,202512010,chara_sur_00501_ja,chara_sur_00501,ja,"空間を操る六番組組長 出雲 天花","魔防隊六番組の組長。和倉 優希を「奴隷クン」と呼び、何としても手に入れようとする。能力は「天御鳥命」(アメノミトリ)で、空間を操作することができ、瞬間移動や応用した戦闘が可能。冷静沈着で子供の頃から優等生。順風満帆な人生を送っている。",遠距離から、広範囲の必殺ワザで相手をスタン状態にすることができるぞ!
e,202512010,chara_sur_00601_ja,chara_sur_00601,ja,"東 八千穂","魔防隊六番隊・副組長。東の家名にこだわりを持っており、非常にプライドが高い。妹の東 日万凛のことを溺愛しているが、なかなか素直に伝えることができずにいる。能力は「東の辰刻」(ゴールデンアワー)で、ポーズを決めると時を止めたり戻したりすることが可能。",中距離からの必殺ワザで複数の相手をスタン状態にすることができるぞ!
e,202512010,chara_sur_00701_ja,chara_sur_00701,ja,"和倉 青羽","魔都に現れた人型醜鬼。正体は魔都災害によって行方不明になっていた優希の姉。京香の故郷を襲った一本角の醜鬼を従えている。魔防隊を敵だと断言し、彼女と同じく醜鬼となった銭函 ココと湯野 波音達と共に魔防隊と戦おうとする。",必殺ワザで複数の相手に連続攻撃するアタックキャラ!素早い攻撃で先陣を切って攻め込むぞ!
e,202512010,chara_sur_00801_ja,chara_sur_00801,ja,"無窮の鎖 和倉 優希","和倉 優希がスレイブとして変身した姿。醜鬼に似ている姿で、首には鎖付きの首輪がついている。使役する主人は優希の背に乗り、鎖によって操縦することが可能。変身を解くと、変身中の働きによって主人からの「褒美」が与えられる。",必殺ワザで単体の相手に攻撃することができるぞ！
e,202512015,chara_yuw_00102_ja,chara_yuw_00102,ja,"愛届ける聖夜のサンタ 橘 美花莉","橘 美花莉がサンタコスチュームに身を包んだ姿。抱えた袋には溢れんばかりの愛が詰まっている。漫画研究部のクリスマスパーティーでは、コスプレ衣装作りに尽力した天乃 リリサへ冬用の私服を贈り、パーティー後に行き場を失った奥村 正宗を自宅でもてなすなど、皆に愛を届けた。",広範囲の必殺ワザで相手にダメージを与えつつ、オブジェクトをランダムな位置に生成することができるぞ!オブジェクトごとの効果をうまく活用して、バトルを有利に進めよう!
e,202512020,chara_osh_00001_ja,chara_osh_00001,ja,"B小町不動のセンター アイ","苺プロダクションのアイドルグループ・B小町の絶対的エース、不動のセンターで究極の美少女。16歳で星野 アクアと星野 ルビーを出産するためにアイドル活動を一時休止。復帰後はドラマや映画に出演したり、モデルやラジオのアシスタントなど幅広く活動し、順調に芸能界を駆け上がっていた。",味方の必殺ワザ発動までの時間を短縮できるぞ!さらに、広範囲の必殺ワザで、複数の相手の攻撃をDOWNできるテクニカルキャラ!
e,202512020,chara_osh_00101_ja,chara_osh_00101,ja,"復讐を誓う片星 星野 アクア","苺プロダクションに所属する俳優で、陽東高校一般科1年生。アクアは通称で本名は星野 愛久愛海(あくあまりん)。子供時代に芸能デビューし、一時休止を挟んで現在は復帰している。母親であるアイを大切に思い、クールな性格で勉強もできるが、復讐のためには冷酷になる一面も持つ。",選択したコマと一つ先までのコマにいる敵にダメージを与えるぞ!さらに味方の再召喚時間を短縮!
e,202512020,chara_osh_00201_ja,chara_osh_00201,ja,"星野 ルビー","苺プロダクション所属のアイドルで、再始動した新生B小町のメンバー。陽東高校芸能科1年生。ルビーは通称で本名は星野 瑠美衣(るびい)。明るい性格で、母親であるアイのような輝くアイドルになることを夢に見続け、何度もオーディションを受け続けていた。",必殺ワザで自身の攻撃をUPするアタックキャラ!
e,202512020,chara_osh_00301_ja,chara_osh_00301,ja,MEMちょ,"ネットで人気のある、バズらせのプロとして活躍するユーチューバーにしてインフルエンサー。星野 アクアに新生B小町に誘われ、一度は諦めたアイドルの道を歩み出した。B小町の配信やMV撮影、動画編集など、インフルエンサーとしてのスキルや人脈を駆使し、B小町を成功へ導く。",必殺ワザで自身と黄属性の味方のダメージをカットできるぞ!
e,202512020,chara_osh_00401_ja,chara_osh_00401,ja,"有馬 かな","陽東高校芸能科2年生。かつて10秒で泣ける天才子役として\n一世を風靡したが、その後は下火になっていた。芸能界の先輩としてのプライドが高く、子役として共演した星野 アクアのことを意識している。苺プロに加入し、女優からアイドルへ転身、新生B小町のセンターとして活動することとなる。",必殺ワザで複数の相手をスタン状態にすることができるぞ!
e,202512020,chara_osh_00501_ja,chara_osh_00501,ja,"黒川 あかね","高校2年生。劇団ララライに所属する若きエース。分析力が非常に高く、まるで役をその身に降ろすかのように演じる。恋愛リアリティショー「今からガチ恋始めます」へ出演するも、演出に翻弄されSNSで炎上。自殺未遂をしてしまうほど追い詰められるも星野 アクアによって助けられる。",必殺ワザで複数の相手の攻撃をDOWNするテクニカルキャラ!
e,202512020,chara_osh_00601_ja,chara_osh_00601,ja,ぴえヨン,苺プロダクションに所属する年収1億円の覆面筋トレ系ユーチューバー。ひよこを模した丸い覆面に、パンツ一枚の姿をしており、小中学生から人気を集めている。新生B小町を宣伝するためにコラボをすることになり、1時間のぴえヨンブートダンスを決行する。,前線で味方を守るディフェンスキャラ!さらに連続攻撃で強さを発揮!
e,202601010,chara_jig_00401_ja,chara_jig_00401,ja,"賊王 亜左 弔兵衛","“賊王”の呼び名で、伊予の山奥に賊の村をもつ傑士。\n強さこそが全てだと信じ、目的のためには手段を選ばない冷酷さと高い適応能力、賊をまとめ上げる天賦の才能で、圧倒的な戦闘力を誇る。唯一の身内で大切に思っている実の弟の山田浅ェ門 桐馬と共に数々の状況を潜り抜けてきた。",必殺ワザで複数の相手を弱体化させつつ、体力も吸収するテクニカルキャラ!さらに、特定の条件で性能が変化するぞ!
e,202601010,chara_jig_00501_ja,chara_jig_00501,ja,"山田浅ェ門 桐馬","山田浅ェ門・試一刀流、段位未定。\n亜左 弔兵衛の実の弟で監視役。兄を助けるために山田家に入門し、わずか1か月で代行免許を得る天稟を持つ。冷静沈着で知的な一面を持ちながらも、その身を賭してでも兄を守ろうとする強い覚悟を持っている。",前線を支えるサポート!攻撃UPとダメージカットで戦況を有利に導くことができるぞ!
e,202601010,chara_jig_00601_ja,chara_jig_00601,ja,"民谷 巌鉄斎","“八洲無双の剣龍”と呼ばれる剣豪。\n藩主の屋敷にあった門扉の龍を切ったことにより、不敬罪に問われ死罪人となった。天下に轟く偉業を成し、後世に語り継がれる名前を残すことによって真の不老不死になることを史上の目標にしている。",味方を守りつつ、必殺ワザの攻撃でチームの火力に貢献するぞ!
e,202601010,chara_jig_00701_ja,chara_jig_00701,ja,メイ,"天仙の劣等種のために蓬莱から追放された少女。\n見た目に反した超人的な力を発揮する。島で起こっていることを知っていながら、向き合ってこなかった後悔に苛まれており、島を出て普通に暮らすために仙薬を探す画眉丸たちと行動を共にする。",特定のコマにいる味方を回復!
e,202602015,chara_you_00001_ja,chara_you_00001,ja,"元殺し屋の新人教諭 リタ","“世界一安全な幼稚園”と言われる「ブラック幼稚園」たんぽぽ組の新人教諭で、元殺し屋。\n一見普通の教員だが、かつては伝説の殺し屋として恐れられていた。抜群の戦闘能力と危機察知能力で幼稚園に日々襲来する殺し屋たちから園児を守っている。夢はイケメンの彼氏をつくること。",必殺ワザで連続攻撃する中距離アタックキャラ!緑属性の相手に対して大ダメージを与えることもできるぞ!
e,202602015,chara_you_00101_ja,chara_you_00101,ja,ルーク,"“世界一安全な幼稚園”と言われる「ブラック幼稚園」きく組の教諭で、元警官。\n少女まんがが好きで、恋愛において最も楽しいのは片想いの時間と考えている。幼稚園内で両想いフラグが成立しそうになるたびに絶妙なタイミングで恋の進展を邪魔しに現れる。",必殺ワザで複数体の相手にダメージを与え、相手を毒状態にするテクニカルキャラ!
e,202602015,chara_you_00201_ja,chara_you_00201,ja,ダグ,"“世界一安全な幼稚園”と言われる「ブラック幼稚園」たんぽぽ組の教諭で、リタの先輩。\n詐欺師として、誰も信用せず、独りで生きてきたが、リタに命を救われ恋に落ちる。鋭い勘と優しい性格を併せ持ち、園児たちにも好かれている。",必殺ワザの攻撃DOWNを駆使して戦うテクニカルキャラ!
e,202602015,chara_you_00301_ja,chara_you_00301,ja,ハナ,"“世界一安全な幼稚園”と言われる「ブラック幼稚園」たんぽぽ組の新人教諭。\nリタの後輩で、爆弾を使用して戦う。殺し屋一族・ブラッドリー一家の末娘。殺し屋としてバディを組んでいた兄を助けて欲しいとリタ達に依頼する。",必殺ワザで赤属性の相手に大ダメージを与えることができるぞ!
e,202602020,chara_kim_00001_ja,chara_kim_00001,ja,"溢れる母性 花園 羽々里","愛城 恋太郎の彼女の1人。29歳。娘である花園 羽香里を守るために「5股男」の愛城 恋太郎から引き離そうとしたが、最終的に彼女になることに。変態と言える域にまで恋太郎ファミリーへの愛が到達している。包み込むような優しさもあるが、学校理事長としての職権濫用もひどい。",広範囲の必殺ワザで複数の相手にダメージを与え、ノックバックさせることができるぞ!さらに、特定の条件で自身の被ダメージをカットする!
e,202602020,chara_kim_00101_ja,chara_kim_00101,ja,"花園 羽香里","愛城 恋太郎の彼女の1人。高校1年生。魅惑的なプロポーションと計算高い策士気質を併せ持つ品行方正な美女。恋に盲目な一面があり、入学早々に院田 唐音と一緒に愛城 恋太郎に告白をした。根は真面目で、他者への思いやりに溢れている。",必殺ワザで複数の相手に連続攻撃するぞ!さらに、黄属性の相手には大ダメージを与えることができるぞ!
e,202602020,chara_kim_00201_ja,chara_kim_00201,ja,"院田 唐音","愛城 恋太郎の彼女の1人。高校1年生。「〇〇じゃないんだからね！」が口癖の、ツインテールがよく似合うツンデレ気質全開の強気な少女。入学早々に花園 羽香里と一緒に愛城 恋太郎に告白をした。常識人なため、彼女たちの中ではツッコミ担当。",必殺ワザの攻撃DOWNを駆使して戦うテクニカルキャラ!
e,202602020,chara_kim_00301_ja,chara_kim_00301,ja,"好本 静","愛城 恋太郎の彼女の1人。高校1年生。読書が大好きでお淑やかな図書委員。会話が苦手なため、愛読書の台詞を引用して話す。愛城 恋太郎からもらったスマホのテキスト読み上げアプリによってさらにコミュニケーションがスムーズになった。",前線を支えるサポート!黄属性の攻撃UPで戦況を有利に導くことができるぞ!
e,202603010,chara_hut_00001_ja,chara_hut_00001,ja,"ひたむきギタリスト 鳩野 ちひろ",「はーとぶれいく」のギターボーカル担当。高校1年生。ちょっと渋めな邦ロックを愛している。高校入学を機に憧れのギターを購入し、軽音学部に入部した。ちょっぴり自意識過剰な性格で、中学生時代の出来事から人前で歌うことに抵抗があるものの、人を惹きつける歌声をしている。,必殺ワザで複数の相手にダメージを与え、ノックバックさせることができるぞ!さらに、『ふつうの軽音部』作品の味方の攻撃をUPするぞ!
e,202603020,chara_sur_00901_ja,chara_sur_00901,ja,dev,dev,dev
e,202603025,chara_kai_00701_ja,chara_kai_00701,ja,dev,dev,dev
e,202603020,chara_kai_00102_ja,chara_kai_00102,ja,dev,dev,dev
e,202603010,chara_hut_00101_ja,chara_hut_00101,ja,"幸山 厘","「はーとぶれいく」のベース担当。高校1年生。成績優秀でベースの腕もあるが、なぜか鳩野 ちひろを神とあがめている。策略家な一面があり、最初のバンド「ラチッタデッラ」解散後、内田 桃と藤井 彩目を引き入れ「はーとぶれいく」を結成する。",青属性の味方と『ふつうの軽音部』作品の味方の攻撃をUPするぞ!
e,202603010,chara_hut_00201_ja,chara_hut_00201,ja,"内田 桃","バンドのドラム担当。高校1年生。鳩野 ちひろのクラスメイトで、入学してすぐに仲良くなった。恋愛に対してコンプレックスを抱えている。最初に組んだバンド「sound sleep」の解散後、「はーとぶれいく」に加入することに。",遠距離から、必殺ワザで相手をスタン状態にすることができるぞ!
e,202603010,chara_hut_00301_ja,chara_hut_00301,ja,"藤井 彩目","バンドのギター担当。高校1年生。ギターは上手いが周りの人間を見下しがちな性格。鷹見 項希と交際していたが、破局。軽音楽部を退部しようとしていたが、鳩野 ちひろの弾き語りに心を動かされ、「はーとぶれいく」へ加入することに。",中距離からの攻撃を得意とするアタックキャラ!必殺ワザの連続攻撃で複数の相手にダメージを与えるぞ!
